[
  {
    "id": "code-as-policies",
    "title": "Code as Policies: Language Model Programs for Embodied Control",
    "date": "2022-09",
    "venue": "ICRA 2023",
    "topics": [
      "code-as-policy"
    ],
    "classification": "core",
    "agent_writes": "Hierarchical Python policies that compose perception, planning, and control APIs.",
    "feedback": [
      "Runtime perception consumed by the generated program",
      "No post-rollout code-repair loop in the original system"
    ],
    "final_artifact": "An executable Python policy program.",
    "evaluation": "Tabletop manipulation, whiteboard drawing, and mobile manipulation across physical robot platforms.",
    "summary": "The foundational CaP formulation: repurpose a language model's code prior to synthesize inspectable robot policies over a curated API.",
    "curator_pick": true,
    "open_source": true,
    "real_robot": true,
    "links": {
      "paper": "https://arxiv.org/abs/2209.07753",
      "code": "https://github.com/google-research/google-research/tree/master/code_as_policies",
      "project": "https://code-as-policies.github.io/"
    }
  },
  {
    "id": "promptbook",
    "title": "How to Prompt Your Robot: A PromptBook for Manipulation Skills with Code as Policies",
    "date": "2023-10",
    "venue": "ICRA 2024",
    "topics": [
      "code-as-policy"
    ],
    "classification": "core",
    "agent_writes": "Robot policy code and new low-level manipulation skills under alternative prompt designs.",
    "feedback": [
      "State-estimation outputs supplied in the prompt",
      "Prompt examples and instructions",
      "No autonomous post-rollout repair loop"
    ],
    "final_artifact": "Executable manipulation-skill code.",
    "evaluation": "Prompt-component ablations and new-skill execution on a mobile manipulator.",
    "summary": "A systematic study of how examples, instructions, chain-of-thought, and state estimation shape CaP skill generation.",
    "open_source": false,
    "real_robot": true,
    "links": {
      "paper": "https://doi.org/10.1109/ICRA57147.2024.10610784"
    }
  },
  {
    "id": "roboscript",
    "title": "RoboScript: Code Generation for Free-Form Manipulation Tasks across Real and Simulation",
    "date": "2024-02",
    "venue": "arXiv",
    "topics": [
      "code-as-policy"
    ],
    "classification": "core",
    "agent_writes": "Deployable manipulation code against a unified ROS and Gazebo interface.",
    "feedback": [
      "Syntax validation",
      "Gazebo simulation validation",
      "Perception and motion-planning outputs"
    ],
    "final_artifact": "Robot-executable manipulation code.",
    "evaluation": "A free-form manipulation benchmark plus end-to-end evaluations on Franka and UR5 embodiments in simulation and reality.",
    "summary": "Moves CaP from idealized APIs toward deployability by unifying code generation, perception, planning, control, and simulation checks.",
    "open_source": false,
    "real_robot": true,
    "links": {
      "paper": "https://arxiv.org/abs/2402.14623"
    }
  },
  {
    "id": "robocodex",
    "title": "RoboCodeX: Multimodal Code Generation for Robotic Behavior Synthesis",
    "date": "2024-02",
    "venue": "ICML 2024",
    "topics": [
      "code-as-policy"
    ],
    "classification": "core",
    "agent_writes": "Tree-structured robot code built from object-centric manipulation units with affordance and safety constraints.",
    "feedback": [
      "Multimodal scene inputs",
      "Object affordances and physical constraints",
      "Iterative self-updating during supervised fine-tuning"
    ],
    "final_artifact": "Executable object-centric robot behavior code.",
    "evaluation": "Four manipulation categories and one navigation task in simulators and on real robots.",
    "summary": "Uses multimodal, tree-structured code generation to translate scene understanding into deployable behavior across tasks and embodiments.",
    "open_source": true,
    "real_robot": true,
    "links": {
      "paper": "https://arxiv.org/abs/2402.16117",
      "code": "https://github.com/RoboCodeX-source/RoboCodeX_code"
    }
  },
  {
    "id": "genchip",
    "title": "GenCHiP: Generating Robot Policy Code for High-Precision and Contact-Rich Manipulation Tasks",
    "date": "2024-04",
    "venue": "IROS 2024",
    "topics": [
      "code-as-policy"
    ],
    "classification": "core",
    "agent_writes": "Policy code over compliant motion primitives with force, stiffness, and pose constraints.",
    "feedback": [
      "Estimated object poses",
      "Force-aware compliant control",
      "No autonomous code-repair loop"
    ],
    "final_artifact": "Executable policy code for precision and contact-rich manipulation.",
    "evaluation": "Subtasks derived from the Functional Manipulation Benchmark and NIST task boards under perception and grasp noise.",
    "summary": "Shows that the action-space abstraction can determine whether generated policy code handles precise, contact-rich tasks.",
    "open_source": false,
    "real_robot": true,
    "links": {
      "paper": "https://arxiv.org/abs/2404.06645",
      "project": "https://dex-code-gen.github.io/dex-code-gen/"
    }
  },
  {
    "id": "robocoder",
    "title": "RoboCoder: Robotic Learning from Basic Skills to General Tasks with Large Language Models",
    "date": "2024-06",
    "venue": "arXiv",
    "topics": [
      "code-as-policy"
    ],
    "classification": "core",
    "agent_writes": "Action code that composes basic skills for progressively harder simulated tasks.",
    "feedback": [
      "Real-time environment observations",
      "Task pass or failure",
      "Dynamic action-code refinement"
    ],
    "final_artifact": "Refined executable action code.",
    "evaluation": "Eighty manually designed tasks across seven simulated entities, including a humanoid setting.",
    "summary": "An early closed-loop coding framework that updates action programs from environment feedback instead of relying only on one-shot synthesis.",
    "open_source": false,
    "real_robot": false,
    "links": {
      "paper": "https://arxiv.org/abs/2406.03757"
    }
  },
  {
    "id": "robopro",
    "title": "Robotic Programmer: Video Instructed Policy Code Generation for Robotic Manipulation",
    "date": "2025-01",
    "venue": "arXiv",
    "topics": [
      "code-as-policy"
    ],
    "classification": "core",
    "agent_writes": "Executable robot policy code that invokes an embodiment-specific skill API.",
    "feedback": [
      "Visual observations and free-form instructions",
      "Video2Code-generated training supervision",
      "No test-time repair loop"
    ],
    "final_artifact": "A policy program for zero-shot manipulation.",
    "evaluation": "Zero-shot manipulation on RLBench and LIBERO plus real-world experiments and API-variation tests.",
    "summary": "Trains a multimodal code generator on 115,000 Video2Code examples, making code synthesis itself the learned robot capability.",
    "open_source": false,
    "real_robot": true,
    "links": {
      "paper": "https://arxiv.org/abs/2501.04268",
      "project": "https://video2code.github.io/RoboPro-website/"
    }
  },
  {
    "id": "dahlia",
    "title": "Embodied Long Horizon Manipulation with Closed-loop Code Generation and Incremental Few-shot Adaptation",
    "date": "2025-03",
    "venue": "arXiv",
    "topics": [
      "code-as-policy"
    ],
    "classification": "core",
    "agent_writes": "Executable long-horizon code plans rather than natural-language subtask lists.",
    "feedback": [
      "RGB-D outcome reports",
      "Structured plan-execution misalignment feedback",
      "Incrementally added successful examples"
    ],
    "final_artifact": "A replanned executable manipulation program.",
    "evaluation": "More than 30 seen and unseen tasks across LoHoRavens, CALVIN, Franka Kitchen, and cluttered real settings.",
    "summary": "DAHLIA closes the loop around executable code plans with a multimodal reporter and incremental few-shot memory.",
    "open_source": true,
    "real_robot": true,
    "links": {
      "paper": "https://arxiv.org/abs/2503.21969",
      "code": "https://github.com/Ghiara/DAHLIA",
      "project": "https://ghiara.github.io/DAHLIA/"
    }
  },
  {
    "id": "genswarm",
    "title": "GenSwarm: Scalable Multi-Robot Code-Policy Generation and Deployment via Language Models",
    "date": "2025-03",
    "venue": "npj Robotics",
    "topics": [
      "code-as-policy"
    ],
    "classification": "core",
    "agent_writes": "Python skill libraries, skill graphs, and deployable code policies for multi-robot systems.",
    "feedback": [
      "Static code checks",
      "Simulation and video feedback",
      "Optional human feedback"
    ],
    "final_artifact": "A verified multi-robot code policy and reusable skill graph.",
    "evaluation": "Simulated and physical multi-robot tasks, including altered and unseen instructions, against agent and CaP baselines.",
    "summary": "Extends CaP to multi-robot deployment with specialized language agents, a skill graph, simulation validation, and hardware translation.",
    "open_source": true,
    "real_robot": true,
    "links": {
      "paper": "https://arxiv.org/abs/2503.23875",
      "code": "https://github.com/WindyLab/GenSwarm"
    }
  },
  {
    "id": "hycodepolicy",
    "title": "HyCodePolicy: Hybrid Language Controllers for Multimodal Monitoring and Decision in Embodied Agents",
    "date": "2025-08",
    "venue": "arXiv",
    "topics": [
      "code-as-policy"
    ],
    "classification": "core",
    "agent_writes": "Checkpointed manipulation programs that can be revised after execution failures.",
    "feedback": [
      "Program execution traces",
      "Checkpoint images",
      "VLM-generated failure analysis"
    ],
    "final_artifact": "A repaired executable manipulation program.",